{
  "schemaVersion": 1,
  "packageId": "wisconsin-demo",
  "name": "Wisconsin ENC demonstration package",
  "generatedAt": "2026-09-17T16:00:00Z",
  "source": {
    "publisher": "NOAA Office of Coast Survey",
    "product": "NOAA ENC",
    "downloadUrl": "https://charts.noaa.gov/ENCs/WI_ENCs.zip",
    "retrievedAt": "2026-09-17T15:30:00Z",
    "userAgreementPath": "./USERAGREEMENT.txt"
  },
  "bounds": [-88.15, 42.85, -87.65, 43.2],
  "depth": {
    "storedUnit": "metre",
    "displayUnit": "foot",
    "verticalDatums": ["Low Water Datum"]
  },
  "tileSets": [
    {
      "id": "demo",
      "format": "pmtiles",
      "url": "./wisconsin-demo.pmtiles",
      "minZoom": 6,
      "maxZoom": 16,
      "layers": ["coastline", "depth-area", "depth-contour", "sounding"]
    }
  ],
  "cells": [
    {
      "name": "US4WI1DP",
      "edition": 1,
      "updateNumber": 4,
      "issueDate": "2025-12-08",
      "updateApplicationDate": "2023-12-21",
      "usageBand": 4,
      "compilationScale": 45000,
      "verticalDatum": "Low Water Datum",
      "bounds": [-88.15, 42.85, -87.65, 43.2]
    }
  ]
}
